{
  "continuity_profile_version": "0.1",
  "profile_id": "robot-a-home-continuity",
  "robot_id": "RCL-V05-ROBOT-A",
  "created_at": "2026-08-17T12:00:00Z",
  "source_embodiment_id": "robot-a-original-body",
  "evidence_refs": [
    "experience://robot-a/follow-user/longitudinal-summary"
  ],
  "signatures": [
    {
      "behavioral_signature_version": "0.1",
      "signature_id": "robot-a-follow-user-home",
      "behavior_id": "FOLLOW_USER",
      "context": {
        "environment": "home",
        "relationship": "primary_user"
      },
      "evidence_refs": [
        "experience://robot-a/follow-user/home"
      ],
      "traits": [
        {
          "trait_id": "follow-distance",
          "dimension": "following_distance",
          "value": 0.82,
          "unit": "m",
          "confidence": 0.96,
          "observed_samples": 1840
        },
        {
          "trait_id": "follow-side",
          "dimension": "lateral_offset",
          "value": 0.18,
          "unit": "m",
          "confidence": 0.94,
          "observed_samples": 1762
        },
        {
          "trait_id": "acceleration-style",
          "dimension": "acceleration_style",
          "value": "soft",
          "confidence": 0.92,
          "observed_samples": 1698
        },
        {
          "trait_id": "turn-delay",
          "dimension": "turn_delay",
          "value": 170,
          "unit": "ms",
          "confidence": 0.89,
          "observed_samples": 1511
        },
        {
          "trait_id": "pre-move-gaze",
          "dimension": "gaze_before_move",
          "value": true,
          "confidence": 0.98,
          "observed_samples": 1620
        },
        {
          "trait_id": "approach-speed",
          "dimension": "approach_speed",
          "value": 0.74,
          "unit": "m/s",
          "confidence": 0.91,
          "observed_samples": 1702
        },
        {
          "trait_id": "stop-overshoot",
          "dimension": "stop_overshoot",
          "value": 0.03,
          "unit": "m",
          "confidence": 0.9,
          "observed_samples": 1584
        }
      ]
    }
  ]
}
